06_resultados/Modelizacion/ranking_modelos.json

[
  {
    "algoritmo":"LogisticRegression",
    "rank_test_roc_auc":1,
    "mean_test_roc_auc":0.8919044092,
    "std_test_roc_auc":0.0135788127,
    "mean_test_recall":0.7350819672,
    "mean_test_precision":0.7809936183,
    "mean_test_f1":0.7570626735,
    "mean_test_accuracy":0.8230958231,
    "parametros":"{\"C\": 14.528246637516036, \"penalty\": \"l2\"}"
  },
  {
    "algoritmo":"LogisticRegression",
    "rank_test_roc_auc":2,
    "mean_test_roc_auc":0.8918618957,
    "std_test_roc_auc":0.0134497323,
    "mean_test_recall":0.7344262295,
    "mean_test_precision":0.7796860088,
    "mean_test_f1":0.75610969,
    "mean_test_accuracy":0.8223587224,
    "parametros":"{\"C\": 55.51721685244721, \"penalty\": \"l2\"}"
  },
  {
    "algoritmo":"LogisticRegression",
    "rank_test_roc_auc":3,
    "mean_test_roc_auc":0.8918528777,
    "std_test_roc_auc":0.0134551696,
    "mean_test_recall":0.7344262295,
    "mean_test_precision":0.7796860088,
    "mean_test_f1":0.75610969,
    "mean_test_accuracy":0.8223587224,
    "parametros":"{\"C\": 73.92266140516048, \"penalty\": \"l1\"}"
  },
  {
    "algoritmo":"LogisticRegression",
    "rank_test_roc_auc":4,
    "mean_test_roc_auc":0.8917085896,
    "std_test_roc_auc":0.0138881817,
    "mean_test_recall":0.7318032787,
    "mean_test_precision":0.7795639393,
    "mean_test_f1":0.7547003927,
    "mean_test_accuracy":0.8216216216,
    "parametros":"{\"C\": 3.4702669886504163, \"penalty\": \"l2\"}"
  },
  {
    "algoritmo":"LogisticRegression",
    "rank_test_roc_auc":5,
    "mean_test_roc_auc":0.8915385359,
    "std_test_roc_auc":0.0136352805,
    "mean_test_recall":0.7298360656,
    "mean_test_precision":0.7774370131,
    "mean_test_f1":0.7526612724,
    "mean_test_accuracy":0.8201474201,
    "parametros":"{\"C\": 1.1435780278433403, \"penalty\": \"l1\"}"
  },
  {
    "algoritmo":"LogisticRegression",
    "rank_test_roc_auc":6,
    "mean_test_roc_auc":0.8914728333,
    "std_test_roc_auc":0.013586056,
    "mean_test_recall":0.7298360656,
    "mean_test_precision":0.7774079359,
    "mean_test_f1":0.7526549693,
    "mean_test_accuracy":0.8201474201,
    "parametros":"{\"C\": 1.0907475835157696, \"penalty\": \"l1\"}"
  },
  {
    "algoritmo":"LogisticRegression",
    "rank_test_roc_auc":7,
    "mean_test_roc_auc":0.8914599504,
    "std_test_roc_auc":0.0135253979,
    "mean_test_recall":0.731147541,
    "mean_test_precision":0.7782986814,
    "mean_test_f1":0.7537440353,
    "mean_test_accuracy":0.8208845209,
    "parametros":"{\"C\": 0.9846738873614566, \"penalty\": \"l1\"}"
  },
  {
    "algoritmo":"LogisticRegression",
    "rank_test_roc_auc":8,
    "mean_test_roc_auc":0.8908557441,
    "std_test_roc_auc":0.0141900053,
    "mean_test_recall":0.7252459016,
    "mean_test_precision":0.78004592,
    "mean_test_f1":0.7514449819,
    "mean_test_accuracy":0.8201474201,
    "parametros":"{\"C\": 1.2357483710912178, \"penalty\": \"l2\"}"
  },
  {
    "algoritmo":"LogisticRegression",
    "rank_test_roc_auc":9,
    "mean_test_roc_auc":0.8907397984,
    "std_test_roc_auc":0.0142829457,
    "mean_test_recall":0.7245901639,
    "mean_test_precision":0.7792667483,
    "mean_test_f1":0.7507504336,
    "mean_test_accuracy":0.8196560197,
    "parametros":"{\"C\": 1.1219752813215704, \"penalty\": \"l2\"}"
  },
  {
    "algoritmo":"LogisticRegression",
    "rank_test_roc_auc":10,
    "mean_test_roc_auc":0.8899526555,
    "std_test_roc_auc":0.01335955,
    "mean_test_recall":0.7160655738,
    "mean_test_precision":0.7787233223,
    "mean_test_f1":0.7458291668,
    "mean_test_accuracy":0.8171990172,
    "parametros":"{\"C\": 0.4206039057901998, \"penalty\": \"l1\"}"
  },
  {
    "algoritmo":"LogisticRegression",
    "rank_test_roc_auc":11,
    "mean_test_roc_auc":0.8894347644,
    "std_test_roc_auc":0.0146735948,
    "mean_test_recall":0.7186885246,
    "mean_test_precision":0.7822607433,
    "mean_test_f1":0.7489958772,
    "mean_test_accuracy":0.8194103194,
    "parametros":"{\"C\": 0.6553013900933984, \"penalty\": \"l2\"}"
  },
  {
    "algoritmo":"LogisticRegression",
    "rank_test_roc_auc":12,
    "mean_test_roc_auc":0.8876485555,
    "std_test_roc_auc":0.0133171662,
    "mean_test_recall":0.6963934426,
    "mean_test_precision":0.7799017638,
    "mean_test_f1":0.7355882781,
    "mean_test_accuracy":0.8125307125,
    "parametros":"{\"C\": 0.21568228019263963, \"penalty\": \"l1\"}"
  },
  {
    "algoritmo":"LogisticRegression",
    "rank_test_roc_auc":13,
    "mean_test_roc_auc":0.8873078038,
    "std_test_roc_auc":0.015165162,
    "mean_test_recall":0.7049180328,
    "mean_test_precision":0.7830518832,
    "mean_test_f1":0.741757256,
    "mean_test_accuracy":0.815970516,
    "parametros":"{\"C\": 0.37253938395788866, \"penalty\": \"l2\"}"
  },
  {
    "algoritmo":"LogisticRegression",
    "rank_test_roc_auc":14,
    "mean_test_roc_auc":0.8866604399,
    "std_test_roc_auc":0.0134160455,
    "mean_test_recall":0.6944262295,
    "mean_test_precision":0.7783274987,
    "mean_test_f1":0.733802359,
    "mean_test_accuracy":0.8113022113,
    "parametros":"{\"C\": 0.19069966103000435, \"penalty\": \"l1\"}"
  },
  {
    "algoritmo":"LogisticRegression",
    "rank_test_roc_auc":15,
    "mean_test_roc_auc":0.8856903604,
    "std_test_roc_auc":0.0134885312,
    "mean_test_recall":0.6885245902,
    "mean_test_precision":0.7762221104,
    "mean_test_f1":0.7295926014,
    "mean_test_accuracy":0.8088452088,
    "parametros":"{\"C\": 0.16949768237884735, \"penalty\": \"l1\"}"
  },
  {
    "algoritmo":"LogisticRegression",
    "rank_test_roc_auc":16,
    "mean_test_roc_auc":0.8851859963,
    "std_test_roc_auc":0.0136439846,
    "mean_test_recall":0.6839344262,
    "mean_test_precision":0.7734054673,
    "mean_test_f1":0.7257661085,
    "mean_test_accuracy":0.8063882064,
    "parametros":"{\"C\": 0.15876781526924, \"penalty\": \"l1\"}"
  },
  {
    "algoritmo":"LogisticRegression",
    "rank_test_roc_auc":17,
    "mean_test_roc_auc":0.8844439434,
    "std_test_roc_auc":0.0138641107,
    "mean_test_recall":0.6780327869,
    "mean_test_precision":0.7720099198,
    "mean_test_f1":0.7218303374,
    "mean_test_accuracy":0.8041769042,
    "parametros":"{\"C\": 0.14445251022763064, \"penalty\": \"l1\"}"
  },
  {
    "algoritmo":"LogisticRegression",
    "rank_test_roc_auc":18,
    "mean_test_roc_auc":0.88243937,
    "std_test_roc_auc":0.0153934353,
    "mean_test_recall":0.6727868852,
    "mean_test_precision":0.7783028818,
    "mean_test_f1":0.7214005401,
    "mean_test_accuracy":0.8054054054,
    "parametros":"{\"C\": 0.17885301261862016, \"penalty\": \"l2\"}"
  },
  {
    "algoritmo":"LogisticRegression",
    "rank_test_roc_auc":19,
    "mean_test_roc_auc":0.8759026056,
    "std_test_roc_auc":0.0159541708,
    "mean_test_recall":0.6386885246,
    "mean_test_precision":0.7704178676,
    "mean_test_f1":0.6981655615,
    "mean_test_accuracy":0.7931203931,
    "parametros":"{\"C\": 0.09022004468565618, \"penalty\": \"l2\"}"
  },
  {
    "algoritmo":"LogisticRegression",
    "rank_test_roc_auc":20,
    "mean_test_roc_auc":0.8727791555,
    "std_test_roc_auc":0.0164075232,
    "mean_test_recall":0.6406557377,
    "mean_test_precision":0.7728282083,
    "mean_test_f1":0.7004685013,
    "mean_test_accuracy":0.7945945946,
    "parametros":"{\"C\": 0.0745934328572655, \"penalty\": \"l1\"}"
  },
  {
    "algoritmo":"LogisticRegression",
    "rank_test_roc_auc":21,
    "mean_test_roc_auc":0.8682939869,
    "std_test_roc_auc":0.0170280144,
    "mean_test_recall":0.5986885246,
    "mean_test_precision":0.7689769583,
    "mean_test_f1":0.6730016204,
    "mean_test_accuracy":0.7820638821,
    "parametros":"{\"C\": 0.04661686413912769, \"penalty\": \"l2\"}"
  },
  {
    "algoritmo":"LogisticRegression",
    "rank_test_roc_auc":22,
    "mean_test_roc_auc":0.8536873973,
    "std_test_roc_auc":0.018276711,
    "mean_test_recall":0.5239344262,
    "mean_test_precision":0.7712576277,
    "mean_test_f1":0.6234868973,
    "mean_test_accuracy":0.7631449631,
    "parametros":"{\"C\": 0.014271483774997193, \"penalty\": \"l2\"}"
  },
  {
    "algoritmo":"LogisticRegression",
    "rank_test_roc_auc":23,
    "mean_test_roc_auc":0.8468620567,
    "std_test_roc_auc":0.0193654075,
    "mean_test_recall":0.4727868852,
    "mean_test_precision":0.783327318,
    "mean_test_f1":0.5894157026,
    "mean_test_accuracy":0.7533169533,
    "parametros":"{\"C\": 0.008263688714158009, \"penalty\": \"l2\"}"
  },
  {
    "algoritmo":"LogisticRegression",
    "rank_test_roc_auc":24,
    "mean_test_roc_auc":0.8468581919,
    "std_test_roc_auc":0.0193683567,
    "mean_test_recall":0.4727868852,
    "mean_test_precision":0.783327318,
    "mean_test_f1":0.5894157026,
    "mean_test_accuracy":0.7533169533,
    "parametros":"{\"C\": 0.008260808399079604, \"penalty\": \"l2\"}"
  },
  {
    "algoritmo":"LogisticRegression",
    "rank_test_roc_auc":25,
    "mean_test_roc_auc":0.8424838159,
    "std_test_roc_auc":0.0188115771,
    "mean_test_recall":0.5291803279,
    "mean_test_precision":0.726138983,
    "mean_test_f1":0.6117004854,
    "mean_test_accuracy":0.7488943489,
    "parametros":"{\"C\": 0.03334792728637585, \"penalty\": \"l1\"}"
  },
  {
    "algoritmo":"LogisticRegression",
    "rank_test_roc_auc":26,
    "mean_test_roc_auc":0.8406177333,
    "std_test_roc_auc":0.0206814311,
    "mean_test_recall":0.3914754098,
    "mean_test_precision":0.7921811906,
    "mean_test_f1":0.5235057924,
    "mean_test_accuracy":0.7334152334,
    "parametros":"{\"C\": 0.004982752357076452, \"penalty\": \"l2\"}"
  },
  {
    "algoritmo":"LogisticRegression",
    "rank_test_roc_auc":27,
    "mean_test_roc_auc":0.8295127057,
    "std_test_roc_auc":0.0219994292,
    "mean_test_recall":0.0813114754,
    "mean_test_precision":0.9647891963,
    "mean_test_f1":0.1497960215,
    "mean_test_accuracy":0.6547911548,
    "parametros":"{\"C\": 0.0019517224641449498, \"penalty\": \"l2\"}"
  },
  {
    "algoritmo":"LogisticRegression",
    "rank_test_roc_auc":28,
    "mean_test_roc_auc":0.8293220394,
    "std_test_roc_auc":0.0220459019,
    "mean_test_recall":0.08,
    "mean_test_precision":0.9639233954,
    "mean_test_f1":0.14754056,
    "mean_test_accuracy":0.6542997543,
    "parametros":"{\"C\": 0.0019145111285710716, \"penalty\": \"l2\"}"
  },
  {
    "algoritmo":"LogisticRegression",
    "rank_test_roc_auc":29,
    "mean_test_roc_auc":0.826876872,
    "std_test_roc_auc":0.0223778762,
    "mean_test_recall":0.0249180328,
    "mean_test_precision":0.9833333333,
    "mean_test_f1":0.0483824032,
    "mean_test_accuracy":0.6343980344,
    "parametros":"{\"C\": 0.0014857392806279248, \"penalty\": \"l2\"}"
  },
  {
    "algoritmo":"LogisticRegression",
    "rank_test_roc_auc":30,
    "mean_test_roc_auc":0.8238146156,
    "std_test_roc_auc":0.022838541,
    "mean_test_recall":0.0,
    "mean_test_precision":0.0,
    "mean_test_f1":0.0,
    "mean_test_accuracy":0.6253071253,
    "parametros":"{\"C\": 0.0010090061869151559, \"penalty\": \"l2\"}"
  }
]

06_resultados/Modelizacion/informe_modelizacion.md

## Configuración ganadora

- Algoritmo: `LogisticRegression`
- Parámetros: `{"C": 14.528246637516036, "max_iter": 5000, "penalty": "l2", "random_state": 42, "solver": "saga"}`
- ROC AUC medio: 0.8919
- Desviación estándar ROC AUC: 0.0136
- Recall medio: 0.7351
- Precisión media: 0.7810
- F1 medio: 0.7571
- Accuracy media: 0.8231